Target type,Geography,Target,First announced,Date in effect,Legal authority,Rate,Sources,Unnamed: 8,Unnamed: 9,Unnamed: 10,Unnamed: 11,Unnamed: 12,Unnamed: 13,country_raw,country_std,First announced_parsed,event_date,month_start,sector_raw,sector_std,country_iso3,mapping_confidence
Economy,Afghanistan,Non-reciprocal trade: Individual rate,8/1/2025,8/7/2025,IEEPA,15%,USTR Press Release,EO 14257,EO 14326,,,,,Afghanistan,AFGHANISTAN,2025-08-01,2025-08-07,2025-08-01,Non-reciprocal trade: Individual rate,GENERAL,AFG,high
Economy,Algeria,Non-reciprocal trade: Individual rate,4/2/2025,8/7/2025,IEEPA,30%,USTR Press Release,EO 14257,EO 14266,ANNEX I,EO 14316,,,Algeria,ALGERIA,2025-04-02,2025-08-07,2025-08-01,Non-reciprocal trade: Individual rate,GENERAL,DZA,high
Economy,Angola,Non-reciprocal trade: Individual rate,4/2/2025,8/7/2025,IEEPA,15%,USTR Press Release,EO 14257,EO 14266,ANNEX I,EO 14316,EO 14326,,Angola,ANGOLA,2025-04-02,2025-08-07,2025-08-01,Non-reciprocal trade: Individual rate,GENERAL,AGO,high
Economy,Argentina,Non-reciprocal trade: Individual rate,4/2/2025,8/7/2025,IEEPA,10%,USTR Press Release,EO 14257,EO 14266,ANNEX I,EO 14316,,,Argentina,ARGENTINA,2025-04-02,2025-08-07,2025-08-01,Non-reciprocal trade: Individual rate,GENERAL,ARG,high
Economy,Australia,Non-reciprocal trade: Individual rate,4/2/2025,8/7/2025,IEEPA,10%,USTR Press Release,EO 14257,EO 14266,ANNEX I,EO 14316,,,Australia,AUSTRALIA,2025-04-02,2025-08-07,2025-08-01,Non-reciprocal trade: Individual rate,GENERAL,AUS,high
Economy,Bangladesh,Non-reciprocal trade: Individual rate,4/2/2025,8/7/2025,IEEPA,20%,USTR Press Release,EO 14257,EO 14266,ANNEX I,EO 14316,White House Fact Sheet,EO 14326,Bangladesh,BANGLADESH,2025-04-02,2025-08-07,2025-08-01,Non-reciprocal trade: Individual rate,GENERAL,BGD,high
Economy,Bolivia,Non-reciprocal trade: Individual rate,8/1/2025,8/7/2025,IEEPA,15%,USTR Press Release,EO 14257,Executive Order,EO 14326,,,,Bolivia,BOLIVIA,2025-08-01,2025-08-07,2025-08-01,Non-reciprocal trade: Individual rate,GENERAL,BOL,high
Economy,Bosnia and Herzegovina,Non-reciprocal trade: Individual rate,4/2/2025,8/7/2025,IEEPA,30%,USTR Press Release,EO 14257,EO 14266,ANNEX I,EO 14316,White House Fact Sheet,EO 14326,Bosnia and Herzegovina,BOSNIA AND HERZEGOVINA,2025-04-02,2025-08-07,2025-08-01,Non-reciprocal trade: Individual rate,GENERAL,BIH,high
Economy,Botswana,Non-reciprocal trade: Individual rate,4/2/2025,8/7/2025,IEEPA,15%,USTR Press Release,EO 14257,EO 14266,ANNEX I,EO 14316,EO 14326,,Botswana,BOTSWANA,2025-04-02,2025-08-07,2025-08-01,Non-reciprocal trade: Individual rate,GENERAL,BWA,high
Economy,Brazil,Government of Brazil policies,7/30/2025,8/6/2025,IEEPA,40%,EO 14323,,,,,,,Brazil,BRAZIL,2025-07-30,2025-08-06,2025-08-01,Government of Brazil policies,OTHER,BRA,high
Economy,Brazil,Non-reciprocal trade: Individual rate,4/2/2025,8/7/2025,IEEPA,10%,USTR Press Release,EO 14257,EO 14266,ANNEX I,EO 14316,EO 14326,,Brazil,BRAZIL,2025-04-02,2025-08-07,2025-08-01,Non-reciprocal trade: Individual rate,GENERAL,BRA,high
Economy,Brazil,Unfair trade practices,7/15/2025,TBD,Section 301,TBD,USTR Press Release,90 FR 34069,,,,,,Brazil,BRAZIL,2025-07-15,,2025-07-01,Unfair trade practices,OTHER,BRA,high
Economy,Brazil,Government of Brazil policies - agricultural exemptions,11/20/2025,11/13/2025,IEEPA,0% (exempt from 40%),White House Tariff Modification,,,,,,,Brazil,BRAZIL,2025-11-20,2025-11-13,2025-11-01,Government of Brazil policies - agricultural exemptions,AGRICULTURE,BRA,high
Economy,Brunei,Non-reciprocal trade: Individual rate,4/2/2025,8/7/2025,IEEPA,25%,USTR Press Release,EO 14257,EO 14266,ANNEX I,EO 14316,EO 14326,,Brunei,BRUNEI,2025-04-02,2025-08-07,2025-08-01,Non-reciprocal trade: Individual rate,GENERAL,BRN,high
Economy,Cambodia,Non-reciprocal trade: Individual rate,4/2/2025,8/7/2025,IEEPA,19%,USTR Press Release,EO 14257,EO 14266,ANNEX I,EO 14316,White House Fact Sheet,EO 14326,Cambodia,CAMBODIA,2025-04-02,2025-08-07,2025-08-01,Non-reciprocal trade: Individual rate,GENERAL,KHM,high
Economy,Cameroon,Non-reciprocal trade: Individual rate,4/2/2025,8/7/2025,IEEPA,15%,USTR Press Release,EO 14257,EO 14266,ANNEX I,EO 14316,EO 14326,,Cameroon,CAMEROON,2025-04-02,2025-08-07,2025-08-01,Non-reciprocal trade: Individual rate,GENERAL,CMR,high
Economy,Canada,USMCA noncompliant goods,2/1/2025,3/4/2025,IEEPA,25%,White House Fact Sheet,,,,,,,Canada,CANADA,2025-02-01,2025-03-04,2025-03-01,USMCA noncompliant goods,OTHER,CAN,high
Economy,Canada,USMCA noncompliant energy products,2/1/2025,3/4/2025,IEEPA,10%,White House Fact Sheet,,,,,,,Canada,CANADA,2025-02-01,2025-03-04,2025-03-01,USMCA noncompliant energy products,ENERGY,CAN,high
Economy,Canada,USMCA noncompliant potash,2/1/2025,3/4/2025,IEEPA,10%,White House Fact Sheet,,,,,,,Canada,CANADA,2025-02-01,2025-03-04,2025-03-01,USMCA noncompliant potash,OTHER,CAN,high
Economy,Canada,Non-reciprocal trade: Individual rate,4/2/2025,8/7/2025,IEEPA,35%,USTR Press Release,EO 14257,EO 14266,ANNEX I,EO 14316,,,Canada,CANADA,2025-04-02,2025-08-07,2025-08-01,Non-reciprocal trade: Individual rate,GENERAL,CAN,high
Economy,Canada,Non-reciprocal trade: Individual rate,2/21/2025,TBD,Section 301,TBD,White House Fact Sheet,,,,,,,Canada,CANADA,2025-02-21,,2025-02-01,Non-reciprocal trade: Individual rate,GENERAL,CAN,high
Economy,Chad,Non-reciprocal trade: Individual rate,4/2/2025,8/7/2025,IEEPA,15%,USTR Press Release,EO 14257,EO 14266,ANNEX I,EO 14316,EO 14326,,Chad,CHAD,2025-04-02,2025-08-07,2025-08-01,Non-reciprocal trade: Individual rate,GENERAL,TCD,high
Economy,China,Non-reciprocal trade: Individual rate,4/2/2025,11/10/2026,IEEPA,34%,USTR Press Release,EO 14257,EO 14266,ANNEX I,EO 14316,,,China,CHINA,2025-04-02,2026-11-10,2026-11-01,Non-reciprocal trade: Individual rate,GENERAL,CHN,high
Economy,China,Non-reciprocal trade: 90-day pause,5/12/2025,5/14/2025,IEEPA,10%,White House Announcement,,,,,,,China,CHINA,2025-05-12,2025-05-14,2025-05-01,Non-reciprocal trade: 90-day pause,GENERAL,CHN,high
Economy,China,Synthetic opioids,2/1/2025,11/10/2025,IEEPA,10%,EO 14195,EO 14228,White House Fact Sheet,,,,,China,CHINA,2025-02-01,2025-11-10,2025-11-01,Synthetic opioids,OTHER,CHN,high
Economy,China,Low value imports (≤$800),2/1/2025,5/2/2025,IEEPA,120% or $100 per item; other duties do not apply,EO 14195,EO 14228,EO 14257,EO 14200,EO 14256,EO 14259,,China,CHINA,2025-02-01,2025-05-02,2025-05-01,Low value imports (≤$800),MARITIME,CHN,high
Economy,China,Modified: Low value imports (≤$800),5/12/2025,5/14/2025,IEEPA,120% or $100 per item; other duties do not apply,EO 14195,EO 14228,EO 14257,EO 14200,EO 14256,EO 14259,Executive Order,China,CHINA,2025-05-12,2025-05-14,2025-05-01,Modified: Low value imports (≤$800),MARITIME,CHN,high
Economy,Costa Rica,Non-reciprocal trade: Individual rate,8/1/2025,8/7/2025,IEEPA,15%,USTR Press Release,EO 14257,EO 14326,,,,,Costa Rica,COSTA RICA,2025-08-01,2025-08-07,2025-08-01,Non-reciprocal trade: Individual rate,GENERAL,CRI,high
Economy,Côte d`Ivoire,Non-reciprocal trade: Individual rate,4/2/2025,8/7/2025,IEEPA,15%,USTR Press Release,EO 14257,EO 14266,ANNEX I,EO 14316,EO 14326,,Côte d`Ivoire,CÔTE D`IVOIRE,2025-04-02,2025-08-07,2025-08-01,Non-reciprocal trade: Individual rate,GENERAL,,unmapped
Economy,Democratic Republic of the Congo,Non-reciprocal trade: Individual rate,4/2/2025,8/7/2025,IEEPA,15%,USTR Press Release,EO 14257,EO 14266,ANNEX I,EO 14316,EO 14326,,Democratic Republic of the Congo,DEMOCRATIC REPUBLIC OF THE CONGO,2025-04-02,2025-08-07,2025-08-01,Non-reciprocal trade: Individual rate,GENERAL,,unmapped
Economy,Ecuador,Non-reciprocal trade: Individual rate,8/1/2025,8/7/2025,IEEPA,15%,USTR Press Release,EO 14257,EO 14326,,,,,Ecuador,ECUADOR,2025-08-01,2025-08-07,2025-08-01,Non-reciprocal trade: Individual rate,GENERAL,ECU,high
Economy,Equatorial Guinea,Non-reciprocal trade: Individual rate,4/2/2025,8/7/2025,IEEPA,13%,USTR Press Release,EO 14257,EO 14266,ANNEX I,EO 14316,EO 14326,,Equatorial Guinea,EQUATORIAL GUINEA,2025-04-02,2025-08-07,2025-08-01,Non-reciprocal trade: Individual rate,GENERAL,GNQ,high
Economy,European Union,Non-reciprocal trade: Individual rate,4/2/2025,8/7/2025,IEEPA,15%,USTR Press Release,EO 14257,EO 14266,ANNEX I,EO 14316,EO 14326,,European Union,EU,2025-04-02,2025-08-07,2025-08-01,Non-reciprocal trade: Individual rate,GENERAL,EUU,pseudo
Economy,European Union,Non-reciprocal trade: Individual rate,2/21/2025,TBD,Section 301,TBD,Presidential Action ,,,,,,,European Union,EU,2025-02-21,,2025-02-01,Non-reciprocal trade: Individual rate,GENERAL,EUU,pseudo
Economy,Falkland Islands,Non-reciprocal trade: Individual rate,4/2/2025,8/7/2025,IEEPA,10%,USTR Press Release,EO 14257,EO 14266,ANNEX I,EO 14316,EO 14326,,Falkland Islands,FALKLAND ISLANDS,2025-04-02,2025-08-07,2025-08-01,Non-reciprocal trade: Individual rate,GENERAL,,unmapped
Economy,Fiji,Non-reciprocal trade: Individual rate,4/2/2025,8/7/2025,IEEPA,15%,USTR Press Release,EO 14257,EO 14266,ANNEX I,EO 14316,EO 14326,,Fiji,FIJI,2025-04-02,2025-08-07,2025-08-01,Non-reciprocal trade: Individual rate,GENERAL,FJI,high
Other,Global,Non-reciprocal trade: Global baseline,4/2/2025,4/5/2025,IEEPA,10%,USTR Press Release,EO 14257,EO 14266,ANNEX I,EO 14316,,,Global,GLOBAL,2025-04-02,2025-04-05,2025-04-01,Non-reciprocal trade: Global baseline,GENERAL,GLB,pseudo
Other,Global,Low value imports (removal of de minimis exemption),7/30/2025,8/29/2025,IEEPA,Removal of duty-free treatment for shipments under $800,EO 14324,,,,,,,Global,GLOBAL,2025-07-30,2025-08-29,2025-08-01,Low value imports (removal of de minimis exemption),MARITIME,GLB,pseudo
Sector,Global,Polysilicon and its derivatives,7/1/2025,Under investigation,Section 232,TBD,90 FR 31955,,,,,,,Global,GLOBAL,2025-07-01,,2025-07-01,Polysilicon and its derivatives,OTHER,GLB,pseudo
Sector,Global,Unmanned Aircraft Systems (UAS/Drones) and parts,7/1/2025,Under investigation,Section 232,TBD,90 FR 31958,,,,,,,Global,GLOBAL,2025-07-01,,2025-07-01,Unmanned Aircraft Systems (UAS/Drones) and parts,AEROSPACE,GLB,pseudo
Sector,Global,Steel and aluminum,2/10/2025,3/12/2025,Section 232,25%,Proclamation 10895,90 FR 11251,Proclamation 10896,,,,,Global,GLOBAL,2025-02-10,2025-03-12,2025-03-01,Steel and aluminum,STEEL_ALUMINUM,GLB,pseudo
Sector,Global,Copper,2/25/2025,8/1/2025,Section 232,50%,EO 14220,White House Proclamation,,,,,,Global,GLOBAL,2025-02-25,2025-08-01,2025-08-01,Copper,METALS,GLB,pseudo
Sector,Global,Timber and lumber,3/1/2025,Report due no later than 11/26/2025,Section 232,TBD,EO 14223,,,,,,,Global,GLOBAL,2025-03-01,,2025-03-01,Timber and lumber,LUMBER,GLB,pseudo
Sector,Global,Automobiles,3/26/2025,4/3/2025,"Section 232, 301, 604",25%,Proclamation 10908,Proclamation 10925,EO 14289,,,,,Global,GLOBAL,2025-03-26,2025-04-03,2025-04-01,Automobiles,AUTOMOTIVE,GLB,pseudo
Sector,Global,Automobile parts,3/26/2025,5/3/2025,"Section 232, 301, 604",25%,Proclamation 10908,Proclamation 10925,EO 14289,,,,,Global,GLOBAL,2025-03-26,2025-05-03,2025-05-01,Automobile parts,AUTOMOTIVE,GLB,pseudo
Sector,Global,Processed critical minerals & derivative products,4/15/2025,Report due no later than 10/12/2025,Section 232,TBD,EO 14272,,,,,,,Global,GLOBAL,2025-04-15,,2025-04-01,Processed critical minerals & derivative products,MINERALS,GLB,pseudo
Sector,Global,Semiconductors and semiconductor manufacturing equipment,4/1/2025,Report due no later than 12/27/2025,Section 232,TBD,90 FR 15950,,,,,,,Global,GLOBAL,2025-04-01,,2025-04-01,Semiconductors and semiconductor manufacturing equipment,SEMICONDUCTORS,GLB,pseudo
Sector,Global,"Trucks, truck parts, and derivative products",4/22/2025,Report due no later than 1/17/2026,Section 232,TBD,90 FR 17371,,,,,,,Global,GLOBAL,2025-04-22,,2025-04-01,"Trucks, truck parts, and derivative products",OTHER,GLB,pseudo
Sector,China,"Maritime, logistics, and shipbuilding",4/17/2024,"Pending implementation, 10/14/2025",Section 301,"Chinese-owned and operated ships: $50 per net ton, Chinese-built ships operated by non-Chinese entities: $18 per net ton, Ship-to-shore cranes, cargo handling machinery: TBD",USTR Press Release,EO 14269,,,,,,China,CHINA,2024-04-17,,2024-04-01,"Maritime, logistics, and shipbuilding",MARITIME,CHN,high
Sector,Global,Pharmaceuticals & pharmaceutical ingredients,4/1/2025,Report due no later than 12/27/2025,Section 232,TBD,90 FR 15951,,,,,,,Global,GLOBAL,2025-04-01,,2025-04-01,Pharmaceuticals & pharmaceutical ingredients,PHARMACEUTICALS,GLB,pseudo
Sector,Global,Commercial aircraft and jet engines & parts ,5/1/2025,Report due no later than 1/26/2026,Section 232,TBD,90 FR 20273,,,,,,,Global,GLOBAL,2025-05-01,,2025-05-01,Commercial aircraft and jet engines & parts ,AEROSPACE,GLB,pseudo
Economy,Ghana,Non-reciprocal trade: Individual rate,8/1/2025,8/7/2025,IEEPA,15%,USTR Press Release,EO 14257,EO 14326,,,,,Ghana,GHANA,2025-08-01,2025-08-07,2025-08-01,Non-reciprocal trade: Individual rate,GENERAL,GHA,high
Economy,Guyana,Non-reciprocal trade: Individual rate,4/2/2025,8/7/2025,IEEPA,15%,USTR Press Release,EO 14257,EO 14266,ANNEX I,EO 14316,EO 14326,,Guyana,GUYANA,2025-04-02,2025-08-07,2025-08-01,Non-reciprocal trade: Individual rate,GENERAL,GUY,high
Economy,Iceland,Non-reciprocal trade: Individual rate,8/1/2025,8/7/2025,IEEPA,15%,USTR Press Release,EO 14257,EO 14326,,,,,Iceland,ICELAND,2025-08-01,2025-08-07,2025-08-01,Non-reciprocal trade: Individual rate,GENERAL,ISL,high
Economy,India,Russian oil imports,8/6/2025,8/27/2025,IEEPA,25%,USTR Press Release,EO 14257,EO 14266,ANNEX I,EO 14316,EO 14326,,India,INDIA,2025-08-06,2025-08-27,2025-08-01,Russian oil imports,ENERGY,IND,high
Economy,India,Non-reciprocal trade: Individual rate,4/2/2025,8/7/2025,IEEPA,25%,USTR Press Release,EO 14257,EO 14266,ANNEX I,EO 14316,EO 14326,,India,INDIA,2025-04-02,2025-08-07,2025-08-01,Non-reciprocal trade: Individual rate,GENERAL,IND,high
Economy,India,Non-reciprocal trade: Individual rate,4/2/2025,8/7/2025,IEEPA,25%,EO 14329,,,,,,,India,INDIA,2025-04-02,2025-08-07,2025-08-01,Non-reciprocal trade: Individual rate,GENERAL,IND,high
Economy,Indonesia,Non-reciprocal trade: Individual rate,4/2/2025,8/7/2025,IEEPA,19%,USTR Press Release,EO 14257,EO 14266,ANNEX I,EO 14316,White House Fact Sheet,EO 14326,Indonesia,INDONESIA,2025-04-02,2025-08-07,2025-08-01,Non-reciprocal trade: Individual rate,GENERAL,IDN,high
Economy,Iraq,Non-reciprocal trade: Individual rate,4/2/2025,8/7/2025,IEEPA,35%,USTR Press Release,EO 14257,EO 14266,ANNEX I,EO 14316,EO 14326,EO 14326,Iraq,IRAQ,2025-04-02,2025-08-07,2025-08-01,Non-reciprocal trade: Individual rate,GENERAL,IRQ,high
Economy,Israel,Non-reciprocal trade: Individual rate,4/2/2025,8/7/2025,IEEPA,15%,USTR Press Release,EO 14257,EO 14266,ANNEX I,EO 14316,EO 14326,EO 14326,Israel,ISRAEL,2025-04-02,2025-08-07,2025-08-01,Non-reciprocal trade: Individual rate,GENERAL,ISR,high
Economy,Japan,Non-reciprocal trade: Individual rate,4/2/2025,8/7/2025,IEEPA,15%,USTR Press Release,EO 14257,EO 14266,ANNEX I,EO 14316,White House Fact Sheet,EO 14326,Japan,JAPAN,2025-04-02,2025-08-07,2025-08-01,Non-reciprocal trade: Individual rate,GENERAL,JPN,high
Economy,Jordan,Non-reciprocal trade: Individual rate,4/2/2025,8/7/2025,IEEPA,15%,USTR Press Release,EO 14257,EO 14266,ANNEX I,EO 14316,EO 14326,EO 14326,Jordan,JORDAN,2025-04-02,2025-08-07,2025-08-01,Non-reciprocal trade: Individual rate,GENERAL,JOR,high
Economy,Kazakhstan,Non-reciprocal trade: Individual rate,4/2/2025,8/7/2025,IEEPA,25%,USTR Press Release,EO 14257,EO 14266,ANNEX I,EO 14316,White House Fact Sheet,EO 14326,Kazakhstan,KAZAKHSTAN,2025-04-02,2025-08-07,2025-08-01,Non-reciprocal trade: Individual rate,GENERAL,KAZ,high
Economy,Laos,Non-reciprocal trade: Individual rate,4/2/2025,8/7/2025,IEEPA,40%,USTR Press Release,EO 14257,EO 14266,ANNEX I,EO 14316,White House Fact Sheet,EO 14326,Laos,LAOS,2025-04-02,2025-08-07,2025-08-01,Non-reciprocal trade: Individual rate,GENERAL,LAO,high
Economy,Lesotho,Non-reciprocal trade: Individual rate,4/2/2025,8/7/2025,IEEPA,15%,USTR Press Release,EO 14257,EO 14266,ANNEX I,EO 14316,EO 14326,,Lesotho,LESOTHO,2025-04-02,2025-08-07,2025-08-01,Non-reciprocal trade: Individual rate,GENERAL,LSO,high
Economy,Libya,Non-reciprocal trade: Individual rate,4/2/2025,8/7/2025,IEEPA,30%,USTR Press Release,EO 14257,EO 14266,ANNEX I,EO 14316,EO 14326,,Libya,LIBYA,2025-04-02,2025-08-07,2025-08-01,Non-reciprocal trade: Individual rate,GENERAL,LBY,high
Economy,Liechtenstein,Non-reciprocal trade: Individual rate,4/2/2025,8/7/2025,IEEPA,15%,USTR Press Release,EO 14257,EO 14266,ANNEX I,EO 14316,EO 14326,,Liechtenstein,LIECHTENSTEIN,2025-04-02,2025-08-07,2025-08-01,Non-reciprocal trade: Individual rate,GENERAL,LIE,high
Economy,Madagascar,Non-reciprocal trade: Individual rate,4/2/2025,8/7/2025,IEEPA,15%,USTR Press Release,EO 14257,EO 14266,ANNEX I,EO 14316,EO 14326,,Madagascar,MADAGASCAR,2025-04-02,2025-08-07,2025-08-01,Non-reciprocal trade: Individual rate,GENERAL,MDG,high
Economy,Malawi,Non-reciprocal trade: Individual rate,4/2/2025,8/7/2025,IEEPA,15%,USTR Press Release,EO 14257,EO 14266,ANNEX I,EO 14316,EO 14326,,Malawi,MALAWI,2025-04-02,2025-08-07,2025-08-01,Non-reciprocal trade: Individual rate,GENERAL,MWI,high
Economy,Malaysia,Non-reciprocal trade: Individual rate,4/2/2025,8/7/2025,IEEPA,19%,USTR Press Release,EO 14257,EO 14266,ANNEX I,EO 14316,White House Fact Sheet,EO 14326,Malaysia,MALAYSIA,2025-04-02,2025-08-07,2025-08-01,Non-reciprocal trade: Individual rate,GENERAL,MYS,high
Economy,Mauritius,Non-reciprocal trade: Individual rate,4/2/2025,8/7/2025,IEEPA,15%,USTR Press Release,EO 14257,EO 14266,ANNEX I,EO 14316,EO 14326,,Mauritius,MAURITIUS,2025-04-02,2025-08-07,2025-08-01,Non-reciprocal trade: Individual rate,GENERAL,MUS,high
Economy,Mexico,Non-USMCA commodities,2/1/2025,3/4/2025,IEEPA,25%,White House Fact Sheet,EO 14326,,,,,,Mexico,MEXICO,2025-02-01,2025-03-04,2025-03-01,Non-USMCA commodities,OTHER,MEX,high
Economy,Mexico,Non-USMCA energy products,2/1/2025,3/4/2025,IEEPA,10%,White House Fact Sheet,,,,,,,Mexico,MEXICO,2025-02-01,2025-03-04,2025-03-01,Non-USMCA energy products,ENERGY,MEX,high
Economy,Mexico,Non-USMCA potash,2/1/2025,3/4/2025,IEEPA,10%,White House Fact Sheet,,,,,,,Mexico,MEXICO,2025-02-01,2025-03-04,2025-03-01,Non-USMCA potash,OTHER,MEX,high
Economy,Mexico,Non-reciprocal trade: Individual rate,4/2/2025,10/30/2025,IEEPA,0%,USTR Press Release,,,,,,,Mexico,MEXICO,2025-04-02,2025-10-30,2025-10-01,Non-reciprocal trade: Individual rate,GENERAL,MEX,high
Economy,Mexico,Digital service taxes,2/21/2025,TBD,Section 301,TBD,White House Fact Sheet,,,,,,,Mexico,MEXICO,2025-02-21,,2025-02-01,Digital service taxes,OTHER,MEX,high
Economy,Moldova,Non-reciprocal trade: Individual rate,4/2/2025,8/7/2025,IEEPA,25%,USTR Press Release,EO 14257,EO 14266,ANNEX I,EO 14316,EO 14326,,Moldova,MOLDOVA,2025-04-02,2025-08-07,2025-08-01,Non-reciprocal trade: Individual rate,GENERAL,MDA,high
Economy,Mozambique,Non-reciprocal trade: Individual rate,4/2/2025,8/7/2025,IEEPA,15%,USTR Press Release,EO 14257,EO 14266,ANNEX I,EO 14316,EO 14326,,Mozambique,MOZAMBIQUE,2025-04-02,2025-08-07,2025-08-01,Non-reciprocal trade: Individual rate,GENERAL,MOZ,high
Economy,Myanmar (Burma),Non-reciprocal trade: Individual rate,4/2/2025,8/7/2025,IEEPA,40%,USTR Press Release,EO 14257,EO 14266,ANNEX I,EO 14316,White House Fact Sheet,EO 14326,Myanmar (Burma),MYANMAR BURMA,2025-04-02,2025-08-07,2025-08-01,Non-reciprocal trade: Individual rate,GENERAL,,unmapped
Economy,Namibia,Non-reciprocal trade: Individual rate,4/2/2025,8/7/2025,IEEPA,15%,USTR Press Release,EO 14257,EO 14266,ANNEX I,EO 14316,EO 14326,,Namibia,NAMIBIA,2025-04-02,2025-08-07,2025-08-01,Non-reciprocal trade: Individual rate,GENERAL,NAM,high
Economy,Nauru,Non-reciprocal trade: Individual rate,4/2/2025,8/7/2025,IEEPA,15%,USTR Press Release,EO 14257,EO 14266,ANNEX I,EO 14316,EO 14326,,Nauru,NAURU,2025-04-02,2025-08-07,2025-08-01,Non-reciprocal trade: Individual rate,GENERAL,NRU,high
Economy,New Zealand,Non-reciprocal trade: Individual rate,8/1/2025,8/7/2025,IEEPA,15%,USTR Press Release,EO 14257,Executive Order,,EO 14326,,,New Zealand,NEW ZEALAND,2025-08-01,2025-08-07,2025-08-01,Non-reciprocal trade: Individual rate,GENERAL,NZL,high
Economy,Nicaragua,Non-reciprocal trade: Individual rate,4/2/2025,8/7/2025,IEEPA,18%,USTR Press Release,EO 14257,EO 14266,ANNEX I,EO 14316,EO 14326,,Nicaragua,NICARAGUA,2025-04-02,2025-08-07,2025-08-01,Non-reciprocal trade: Individual rate,GENERAL,NIC,high
Economy,Nigeria,Non-reciprocal trade: Individual rate,4/2/2025,8/7/2025,IEEPA,15%,USTR Press Release,EO 14257,EO 14266,ANNEX I,EO 14316,EO 14326,,Nigeria,NIGERIA,2025-04-02,2025-08-07,2025-08-01,Non-reciprocal trade: Individual rate,GENERAL,NGA,high
Economy,North Macedonia,Non-reciprocal trade: Individual rate,4/2/2025,8/7/2025,IEEPA,15%,USTR Press Release,EO 14257,EO 14266,ANNEX I,EO 14316,EO 14326,,North Macedonia,NORTH MACEDONIA,2025-04-02,2025-08-07,2025-08-01,Non-reciprocal trade: Individual rate,GENERAL,MKD,high
Economy,Norway,Non-reciprocal trade: Individual rate,4/2/2025,8/7/2025,IEEPA,15%,USTR Press Release,EO 14257,EO 14266,ANNEX I,EO 14316,EO 14326,,Norway,NORWAY,2025-04-02,2025-08-07,2025-08-01,Non-reciprocal trade: Individual rate,GENERAL,NOR,high
Economy,Pakistan,Non-reciprocal trade: Individual rate,4/2/2025,8/7/2025,IEEPA,19%,USTR Press Release,EO 14257,EO 14266,ANNEX I,EO 14316,EO 14326,,Pakistan,PAKISTAN,2025-04-02,2025-08-07,2025-08-01,Non-reciprocal trade: Individual rate,GENERAL,PAK,high
Economy,Papa New Guinea,Non-reciprocal trade: Individual rate,8/1/2025,8/7/2025,IEEPA,15%,USTR Press Release,EO 14257,EO 14326,,,,,Papa New Guinea,PAPA NEW GUINEA,2025-08-01,2025-08-07,2025-08-01,Non-reciprocal trade: Individual rate,GENERAL,,unmapped
Economy,Philippines,Non-reciprocal trade: Individual rate,4/2/2025,8/7/2025,IEEPA,19%,USTR Press Release,EO 14257,EO 14266,ANNEX I,EO 14316,EO 14326,,Philippines,PHILIPPINES,2025-04-02,2025-08-07,2025-08-01,Non-reciprocal trade: Individual rate,GENERAL,PHL,high
Economy,Russia,Non-reciprocal trade: Individual rate,4/2/2025,8/7/2025,IEEPA,0%,USTR Press Release,EO 14257,EO 14266,ANNEX I,EO 14316,EO 14326,,Russia,RUSSIA,2025-04-02,2025-08-07,2025-08-01,Non-reciprocal trade: Individual rate,GENERAL,RUS,high
Economy,Saudi Arabia,Non-reciprocal trade: Individual rate,4/2/2025,8/7/2025,IEEPA,10%,USTR Press Release,EO 14257,EO 14266,ANNEX I,EO 14316,EO 14326,,Saudi Arabia,SAUDI ARABIA,2025-04-02,2025-08-07,2025-08-01,Non-reciprocal trade: Individual rate,GENERAL,SAU,high
Economy,Serbia,Non-reciprocal trade: Individual rate,4/2/2025,8/7/2025,IEEPA,35%,USTR Press Release,EO 14257,EO 14266,ANNEX I,EO 14316,White House Fact Sheet,EO 14326,Serbia,SERBIA,2025-04-02,2025-08-07,2025-08-01,Non-reciprocal trade: Individual rate,GENERAL,SRB,high
Economy,South Africa,Non-reciprocal trade: Individual rate,4/2/2025,8/7/2025,IEEPA,30%,USTR Press Release,EO 14257,EO 14266,ANNEX I,EO 14316,White House Fact Sheet,EO 14326,South Africa,SOUTH AFRICA,2025-04-02,2025-08-07,2025-08-01,Non-reciprocal trade: Individual rate,GENERAL,ZAF,high
Economy,South Korea,Non-reciprocal trade: Individual rate,4/2/2025,8/7/2025,IEEPA,15%,USTR Press Release,EO 14257,EO 14266,ANNEX I,EO 14316,White House Fact Sheet,EO 14326,South Korea,SOUTH KOREA,2025-04-02,2025-08-07,2025-08-01,Non-reciprocal trade: Individual rate,GENERAL,KOR,high
Economy,Sri Lanka,Non-reciprocal trade: Individual rate,4/2/2025,8/7/2025,IEEPA,20%,USTR Press Release,EO 14257,EO 14266,ANNEX I,EO 14316,EO 14326,,Sri Lanka,SRI LANKA,2025-04-02,2025-08-07,2025-08-01,Non-reciprocal trade: Individual rate,GENERAL,LKA,high
Economy,Switzerland,Non-reciprocal trade: Individual rate,4/2/2025,8/7/2025,IEEPA,39%,USTR Press Release,EO 14257,EO 14266,ANNEX I,EO 14316,EO 14326,,Switzerland,SWITZERLAND,2025-04-02,2025-08-07,2025-08-01,Non-reciprocal trade: Individual rate,GENERAL,CHE,high
Economy,Syria,Non-reciprocal trade: Individual rate,4/2/2025,8/7/2025,IEEPA,41%,USTR Press Release,EO 14257,EO 14266,ANNEX I,EO 14316,EO 14326,,Syria,SYRIA,2025-04-02,2025-08-07,2025-08-01,Non-reciprocal trade: Individual rate,GENERAL,SYR,high
Economy,Taiwan,Non-reciprocal trade: Individual rate,4/2/2025,8/7/2025,IEEPA,20%,USTR Press Release,EO 14257,EO 14266,ANNEX I,EO 14316,EO 14326,,Taiwan,TAIWAN,2025-04-02,2025-08-07,2025-08-01,Non-reciprocal trade: Individual rate,GENERAL,TWN,high
Economy,Thailand,Non-reciprocal trade: Individual rate,4/2/2025,8/7/2025,IEEPA,19%,USTR Press Release,EO 14257,EO 14266,ANNEX I,EO 14316,White House Fact Sheet,EO 14326,Thailand,THAILAND,2025-04-02,2025-08-07,2025-08-01,Non-reciprocal trade: Individual rate,GENERAL,THA,high
Economy,Trinidad and Tobago,Non-reciprocal trade: Individual rate,8/1/2025,8/7/2025,IEEPA,15%,USTR Press Release,EO 14257,EO 14326,,,,,Trinidad and Tobago,TRINIDAD AND TOBAGO,2025-08-01,2025-08-07,2025-08-01,Non-reciprocal trade: Individual rate,GENERAL,TTO,high
Economy,Tunisia,Non-reciprocal trade: Individual rate,4/2/2025,8/7/2025,IEEPA,25%,USTR Press Release,EO 14257,EO 14266,ANNEX I,EO 14316,White House Fact Sheet,EO 14326,Tunisia,TUNISIA,2025-04-02,2025-08-07,2025-08-01,Non-reciprocal trade: Individual rate,GENERAL,TUN,high
Economy,Turkey,Non-reciprocal trade: Individual rate,8/1/2025,8/7/2025,IEEPA,15%,USTR Press Release,EO 14257,EO 14266,ANNEX I,EO 14316,EO 14326,,Turkey,TURKIYE,2025-08-01,2025-08-07,2025-08-01,Non-reciprocal trade: Individual rate,GENERAL,TUR,high
Economy,Uganda,Non-reciprocal trade: Individual rate,8/1/2025,8/7/2025,IEEPA,15%,USTR Press Release,EO 14257,EO 14326,,,,,Uganda,UGANDA,2025-08-01,2025-08-07,2025-08-01,Non-reciprocal trade: Individual rate,GENERAL,UGA,high
Economy,United Kingdom,Non-reciprocal trade: Individual rate,4/2/2025,8/7/2025,IEEPA,10%,USTR Press Release,EO 14257,EO 14266,ANNEX I,EO 14316,EO 14326,,United Kingdom,UK,2025-04-02,2025-08-07,2025-08-01,Non-reciprocal trade: Individual rate,GENERAL,GBR,high
Economy,United Kingdom,Aerospace products,6/16/2025,6/23/2025,"Section 232, 604, 301",Exempt from reciprocal tariffs,EO 14309,White House Fact Sheet,,,,,,United Kingdom,UK,2025-06-16,2025-06-23,2025-06-01,Aerospace products,AEROSPACE,GBR,high
Economy,United Kingdom,Automobiles (within quota),6/16/2025,6/23/2025,"Section 232, 604, 301",10% (including MFN and within quota) / 25% (over quota),EO 14309,White House Fact Sheet,,,,,,United Kingdom,UK,2025-06-16,2025-06-23,2025-06-01,Automobiles (within quota),AUTOMOTIVE,GBR,high
Economy,United Kingdom,Automobile parts,6/16/2025,6/23/2025,"Section 232, 604, 301",10% (including MFN duties),EO 14309,White House Fact Sheet,,,,,,United Kingdom,UK,2025-06-16,2025-06-23,2025-06-01,Automobile parts,AUTOMOTIVE,GBR,high
Economy,Vanuatu,Non-reciprocal trade: Individual rate,4/2/2025,8/7/2025,IEEPA,15%,USTR Press Release,EO 14257,EO 14266,ANNEX I,EO 14316,EO 14326,,Vanuatu,VANUATU,2025-04-02,2025-08-07,2025-08-01,Non-reciprocal trade: Individual rate,GENERAL,VUT,high
Economy,Venezuela,Non-reciprocal trade: Individual rate,4/2/2025,8/7/2025,IEEPA,15%,USTR Press Release,EO 14257,EO 14266,ANNEX I,EO 14316,EO 14326,,Venezuela,VENEZUELA,2025-04-02,2025-08-07,2025-08-01,Non-reciprocal trade: Individual rate,GENERAL,VEN,high
Economy,Vietnam,Non-reciprocal trade: Individual rate,4/2/2025,8/7/2025,IEEPA,20%,USTR Press Release,EO 14257,EO 14266,ANNEX I,EO 14316,EO 14326,,Vietnam,VIETNAM,2025-04-02,2025-08-07,2025-08-01,Non-reciprocal trade: Individual rate,GENERAL,VNM,high
Economy,Zambia,Non-reciprocal trade: Individual rate,4/2/2025,8/7/2025,IEEPA,15%,USTR Press Release,EO 14257,EO 14266,ANNEX I,EO 14316,EO 14326,,Zambia,ZAMBIA,2025-04-02,2025-08-07,2025-08-01,Non-reciprocal trade: Individual rate,GENERAL,ZMB,high
Economy,Zimbabwe,Non-reciprocal trade: Individual rate,4/2/2025,8/7/2025,IEEPA,18%,USTR Press Release,EO 14257,EO 14266,ANNEX I,EO 14316,EO 14326,,Zimbabwe,ZIMBABWE,2025-04-02,2025-08-07,2025-08-01,Non-reciprocal trade: Individual rate,GENERAL,ZWE,high
